{
  "$schema": "https://json-schema.org/draft/2020-12/schema",
  "$id": "https://trackers.example/schemas/learning-library-entry-v1.json",
  "title": "Trackers Learning Library Entry v1",
  "type": "object",
  "additionalProperties": false,
  "required": [
    "$schema",
    "schemaVersion",
    "id",
    "slug",
    "version",
    "packageType",
    "templateKind",
    "title",
    "summary",
    "description",
    "categoryIds",
    "tags",
    "levels",
    "estimatedWeeks",
    "creator",
    "license",
    "template",
    "publishedAt",
    "updatedAt"
  ],
  "properties": {
    "$schema": {
      "type": "string",
      "pattern": "^https://.+/schemas/learning-library-entry-v1\\.json$"
    },
    "schemaVersion": {
      "const": 1
    },
    "id": {
      "$ref": "#/$defs/key"
    },
    "slug": {
      "$ref": "#/$defs/key"
    },
    "version": {
      "$ref": "#/$defs/semver"
    },
    "packageType": {
      "enum": ["tracker", "bundle"]
    },
    "templateKind": {
      "enum": ["study-template", "dsa-template", "workspace-template"]
    },
    "title": {
      "$ref": "#/$defs/titleText"
    },
    "summary": {
      "$ref": "#/$defs/summaryText"
    },
    "description": {
      "$ref": "#/$defs/descriptionText"
    },
    "categoryIds": {
      "type": "array",
      "minItems": 1,
      "maxItems": 10,
      "uniqueItems": true,
      "items": {
        "$ref": "#/$defs/key"
      }
    },
    "tags": {
      "type": "array",
      "maxItems": 20,
      "uniqueItems": true,
      "items": {
        "$ref": "#/$defs/key"
      }
    },
    "levels": {
      "type": "array",
      "minItems": 1,
      "maxItems": 4,
      "uniqueItems": true,
      "items": {
        "enum": ["beginner", "intermediate", "advanced", "mixed"]
      }
    },
    "estimatedWeeks": {
      "type": "integer",
      "minimum": 1,
      "maximum": 520
    },
    "creator": {
      "$ref": "#/$defs/creator"
    },
    "license": {
      "$ref": "#/$defs/license"
    },
    "cover": {
      "$ref": "#/$defs/cover"
    },
    "template": {
      "$ref": "#/$defs/templateRef"
    },
    "publishedAt": {
      "$ref": "#/$defs/isoUtcDate"
    },
    "updatedAt": {
      "$ref": "#/$defs/isoUtcDate"
    }
  },
  "allOf": [
    {
      "if": {
        "properties": {
          "packageType": {
            "const": "tracker"
          }
        }
      },
      "then": {
        "properties": {
          "templateKind": {
            "enum": ["study-template", "dsa-template"]
          }
        }
      }
    },
    {
      "if": {
        "properties": {
          "packageType": {
            "const": "bundle"
          }
        }
      },
      "then": {
        "properties": {
          "templateKind": {
            "const": "workspace-template"
          }
        }
      }
    }
  ],
  "$defs": {
    "key": {
      "type": "string",
      "minLength": 1,
      "maxLength": 80,
      "pattern": "^[a-z0-9][a-z0-9-]{0,79}$"
    },
    "semver": {
      "type": "string",
      "maxLength": 120,
      "pattern": "^\\d+\\.\\d+\\.\\d+(?:-[0-9A-Za-z.-]+)?(?:\\+[0-9A-Za-z.-]+)?$"
    },
    "titleText": {
      "type": "string",
      "minLength": 1,
      "maxLength": 160
    },
    "summaryText": {
      "type": "string",
      "minLength": 1,
      "maxLength": 240
    },
    "descriptionText": {
      "type": "string",
      "minLength": 1,
      "maxLength": 4000
    },
    "sha256": {
      "type": "string",
      "pattern": "^[a-f0-9]{64}$"
    },
    "isoUtcDate": {
      "type": "string",
      "pattern": "^\\d{4}-\\d{2}-\\d{2}T\\d{2}:\\d{2}:\\d{2}(?:\\.\\d+)?Z$"
    },
    "creator": {
      "type": "object",
      "additionalProperties": false,
      "required": ["id", "displayName"],
      "properties": {
        "id": {
          "type": "string",
          "minLength": 1,
          "maxLength": 80,
          "pattern": "^[a-z0-9][a-z0-9.-]{0,79}$"
        },
        "displayName": {
          "type": "string",
          "minLength": 1,
          "maxLength": 100
        },
        "profileUrl": {
          "type": "string",
          "minLength": 1,
          "maxLength": 2048,
          "pattern": "^https://"
        }
      }
    },
    "license": {
      "type": "object",
      "additionalProperties": false,
      "required": ["spdxId", "attributionText"],
      "properties": {
        "spdxId": {
          "type": "string",
          "minLength": 1,
          "maxLength": 50,
          "pattern": "^[A-Za-z0-9.-]+$"
        },
        "attributionText": {
          "type": "string",
          "minLength": 1,
          "maxLength": 160
        }
      }
    },
    "cover": {
      "type": "object",
      "additionalProperties": false,
      "required": ["path", "alt", "sha256", "bytes", "width", "height"],
      "properties": {
        "path": {
          "type": "string",
          "minLength": 1,
          "maxLength": 200,
          "pattern": "^[a-zA-Z0-9_-]+\\.(webp|png|jpe?g)$"
        },
        "alt": {
          "type": "string",
          "minLength": 1,
          "maxLength": 200
        },
        "sha256": {
          "$ref": "#/$defs/sha256"
        },
        "bytes": {
          "type": "integer",
          "minimum": 1,
          "maximum": 512000
        },
        "width": {
          "type": "integer",
          "minimum": 16,
          "maximum": 2400
        },
        "height": {
          "type": "integer",
          "minimum": 16,
          "maximum": 1600
        }
      }
    },
    "templateRef": {
      "type": "object",
      "additionalProperties": false,
      "required": ["path", "sha256", "bytes"],
      "properties": {
        "path": {
          "type": "string",
          "minLength": 1,
          "maxLength": 200,
          "pattern": "^[a-zA-Z0-9_-]+\\.json$"
        },
        "sha256": {
          "$ref": "#/$defs/sha256"
        },
        "bytes": {
          "type": "integer",
          "minimum": 1,
          "maximum": 2097152
        }
      }
    }
  }
}
