{
  "$schema": "https://trackers.example/schemas/learning-library-entry-v1.json",
  "schemaVersion": 1,
  "id": "dsa-fundamentals",
  "slug": "dsa-fundamentals",
  "version": "1.0.0",
  "packageType": "tracker",
  "templateKind": "dsa-template",
  "title": "DSA fundamentals",
  "summary": "A deliberately small foundation for building problem-solving habits.",
  "description": "A deliberately bounded foundation for core problem-solving habits. Covers key array, hashing, and two-pointer techniques across essential patterns.",
  "categoryIds": ["dsa-algorithms", "interview-preparation"],
  "tags": ["arrays", "hashing", "two-pointers"],
  "levels": ["beginner"],
  "estimatedWeeks": 4,
  "creator": {
    "id": "curator.trackers",
    "displayName": "Trackers Team",
    "profileUrl": "https://trackers.example"
  },
  "license": {
    "spdxId": "MIT",
    "attributionText": "Trackers"
  },
  "template": {
    "path": "template.json",
    "sha256": "ce73d00b63ae520518c7cede3a14d9e89169d04d0a27b6ea799085e0672375dd",
    "bytes": 1248
  },
  "publishedAt": "2026-10-01T00:00:00Z",
  "updatedAt": "2026-10-01T00:00:00Z"
}
